{
  "name": "answers a calculation using the calculator tool",
  "kind": "golden",
  "input": "What is 127 multiplied by 43?",
  "assertions": [
    {
      "type": "tool_was_called",
      "value": "calculator",
      "why": "arithmetic goes to the tool rather than to the model's own guess"
    },
    { "type": "contains", "value": "5461" },
    {
      "type": "max_iterations",
      "value": 4,
      "why": "one tool call and one answer; more means the loop is circling"
    }
  ]
}
